{
  "id": "factorio",
  "slug": "factorio",
  "name": {
    "zh": "异星工厂",
    "en": "Factorio"
  },
  "aliases": [
    "Factorio"
  ],
  "summary": "Wube Software 自动化工厂建造游戏，从手工采矿到庞大的生产线；官方 MOD 门户生态完善。",
  "genres": [
    "automation",
    "strategy"
  ],
  "os": [
    "windows",
    "macos",
    "linux"
  ],
  "channels": [
    {
      "platform": "steam",
      "type": "buy",
      "url": "https://store.steampowered.com/app/427520/",
      "priceNote": "买断制",
      "linkHealth": "ok",
      "checkedAt": "2026-10-24"
    },
    {
      "platform": "gog",
      "type": "buy",
      "url": "https://www.gog.com/game/factorio",
      "priceNote": "无 DRM 版本",
      "linkHealth": "ok",
      "checkedAt": "2026-10-24"
    },
    {
      "platform": "official",
      "type": "buy",
      "url": "https://www.factorio.com/buy",
      "priceNote": "官方网站",
      "linkHealth": "ok",
      "checkedAt": "2026-10-24"
    }
  ],
  "savePaths": [
    {
      "os": "windows",
      "path": "%APPDATA%\\Factorio\\saves"
    }
  ],
  "relatedGameIds": [
    "rimworld",
    "civilization-6"
  ],
  "sources": [
    {
      "name": "Steam",
      "url": "https://store.steampowered.com/app/427520/"
    },
    {
      "name": "PCGamingWiki",
      "url": "https://www.pcgamingwiki.com/api/appid.php?appid=427520"
    }
  ],
  "reviewStatus": "verified",
  "checkedAt": "2026-10-24",
  "createdAt": "2026-10-24",
  "updatedAt": "2026-10-24",
  "publishStatus": "published"
}
